GroupName,en,ko,cn,jp,ph,kh,th,af,ru,vn,ar,sentence
행동,act,행동,做,行為,kumilos na,ទង្វើ,ประพฤติ,Wet,действовать,hành động,فعل,"It's important to act quickly.
빨리 행동하는 것이 중요해.
Yes, we don't have much time.
맞아, 시간이 많지 않아."
행동,ask,묻다,问,頼む,magtanong ka,សួរ,ถาม,Vra,спрашивать,hỏi,طَلَبَ,"Can I ask you a question?
질문 좀 해도 될까?
Sure, go ahead.
물론, 해봐."
행동,bake,굽다,烤,焼く,maghurno,១. នំបញ្ចុក,อบ,Bak,печь,bỏ lò,خبز,"Do you know how to bake cookies?
쿠키 굽는 법 알아?
Yes, I can show you.
응, 내가 가르쳐줄게."
행동,bring,가져오다,带,持って来る,dalhin ang,នាំ មក,เอามา,Bring,приносить,đem,جلب,"Can you bring me that book?
저 책 좀 가져다줄래?
Sure, here it is.
물론, 여기 있어."
행동,build,짓다,建,建てる,bumuo ng,សង់,สร้าง,Bou,строить,xây dựng,بنى,"Let's build a sandcastle.
모래성을 쌓아보자.
That sounds fun!
재미있을 것 같아!"
행동,buy,사다,买,買う,bumili ka na,ទិញ,ซื้อ,Koop,покупать,mua,ابتاع,"I want to buy new phone.
나 새 핸드폰 사고싶어.
Your cell phone is still fine.
아직 멀쩡한 것 같아."
행동,call,부르다,叫,呼び出し,tawag sa,ហៅ,เรียก,Oproep,звать,gọi,دعا,"Can you call me later?
나중에 전화해줄래?
Sure, I'll call you tonight.
물론, 오늘 밤에 전화할게."
행동,catch,잡다,抓住,捕まえる,mahuli ang,ចាប់,จับ,Vang,ловить,bắt,القبض,"Which color do you choose?
어떤 색을 선택할래?
I choose blue.
나는 파란색을 선택해."
행동,choose,고르다,选择,選ぶ,pumili ng,ជ្រើសរើស,เลือก,Kies,выбирать,chọn,اختار,"Can you catch the ball?
공을 잡을 수 있겠어?
Yes, I got it.
응, 잡았어."
